id,conversation_id,created_at,date,time,timezone,user_id,username,name,place,tweet,mentions,urls,photos,replies_count,retweets_count,likes_count,hashtags,cashtags,link,retweet,quote_url,video,near,geo,source,user_rt_id,user_rt,retweet_id,reply_to,retweet_date,translate,trans_src,trans_dest
1243336526697807872,1243336526697807872,1585269502000,2020-03-26,20:38:22,Eastern Daylight Time,45260503,jhardawayjr,"Jimmie Hardaway, Jr.",,Beloved Harlem pastor dies of coronavirus  https://www.pix11.com/news/coronavirus/beloved-harlem-pastor-dies-of-virus-related-issues …,[],['https://www.pix11.com/news/coronavirus/beloved-harlem-pastor-dies-of-virus-related-issues'],[],0,0,0,[],[],https://twitter.com/JHardawayJr/status/1243336526697807872,False,,0,,"43.082366,-79.321248,40km",,,,,"[{'user_id': '45260503', 'username': 'JHardawayJr'}]",,,,
1243335736562274307,1243335736562274307,1585269314000,2020-03-26,20:35:14,Eastern Daylight Time,1022079161366728704,lynnholliday8,Lynn of the Valley,,"I mean, seriously? We are going to leave a country with relatively low spread of Covid-19 (and one of the most envied Healthcare systems), and illegally cross into one of the border states that has achieved stratospheric liftoff in Covid-19 cases? Sure....
#NoCanadian https://twitter.com/NelsonMillar13/status/1243275792404164609 …",[],['https://twitter.com/NelsonMillar13/status/1243275792404164609'],[],0,0,0,['#nocanadian'],[],https://twitter.com/LynnHolliday8/status/1243335736562274307,False,https://twitter.com/NelsonMillar13/status/1243275792404164609,0,,"43.082366,-79.321248,40km",,,,,"[{'user_id': '1022079161366728704', 'username': 'LynnHolliday8'}]",,,,
1243334438987149312,1243334438987149312,1585269004000,2020-03-26,20:30:04,Eastern Daylight Time,51311437,aaronbesecker,Aaron Besecker,,Death toll up to 5 in Erie County as confirmed Covid-19 cases across WNY swell to 260: biggest one-day jump in cases in county so far in outbreak  https://buffalonews.com/2020/03/26/erie-county-coronavirus-cases-increase-by-20-to-total-of-166/ …,[],['https://buffalonews.com/2020/03/26/erie-county-coronavirus-cases-increase-by-20-to-total-of-166/'],[],0,0,0,[],[],https://twitter.com/AaronBesecker/status/1243334438987149312,False,,0,,"43.082366,-79.321248,40km",,,,,"[{'user_id': '51311437', 'username': 'AaronBesecker'}]",,,,
1243334233705381900,1243334233705381900,1585268956000,2020-03-26,20:29:16,Eastern Daylight Time,583311881,greyforesthomes,GreyForestHomes,,"#Coronavirus We are doing all we can to prevent the spread of the Coronavirus including closing all of our Open Houses for this weekend again.   Social distancing, isolation and self monitoring are all part of our daily routine now.   http://greyforesthomes.ca/?p=15349  pic.twitter.com/lol1V36zVC",[],['http://greyforesthomes.ca/?p=15349'],['https://pbs.twimg.com/media/EUE14MjXsAI_poQ.jpg'],0,0,0,['#coronavirus'],[],https://twitter.com/GreyForestHomes/status/1243334233705381900,False,,0,,"43.082366,-79.321248,40km",,,,,"[{'user_id': '583311881', 'username': 'GreyForestHomes'}]",,,,
1243334029174280192,1243334029174280192,1585268907000,2020-03-26,20:28:27,Eastern Daylight Time,26828299,joannesd,RunsNiagaraFalls,,My laundry proves I'm #stayinghome I haven't worn or washed a thong in 2 weeks #coronavirus #coronameme #covid19Canada #StayHome,[],[],[],0,0,0,"['#stayinghome', '#coronavirus', '#coronameme', '#covid19canada', '#stayhome']",[],https://twitter.com/joannesd/status/1243334029174280192,False,,0,,"43.082366,-79.321248,40km",,,,,"[{'user_id': '26828299', 'username': 'joannesd'}]",,,,
1243331147716685824,1243331147716685824,1585268220000,2020-03-26,20:17:00,Eastern Daylight Time,47997021,1057ezrock,105.7 EZ Rock,,"Elton John is hosting a benefit for US health care workers featuring Alicia Keys, Backstreet Boys, Billie Eilish, Green Day’s Bille Joe Armstrong, Mariah Carey and Tim McGraw all performing from home

 https://www.iheartradio.ca/ez-rock/1057ezrock/news/music/elton-john-hosting-benefit-for-u-s-health-care-workers-1.11182488 …
#covid19  pic.twitter.com/mK4Zv7pPNm",[],['https://www.iheartradio.ca/ez-rock/1057ezrock/news/music/elton-john-hosting-benefit-for-u-s-health-care-workers-1.11182488'],['https://pbs.twimg.com/media/EUDcRz1WAAAjV59.jpg'],0,2,2,['#covid19'],[],https://twitter.com/1057ezrock/status/1243331147716685824,False,,0,,"43.082366,-79.321248,40km",,,,,"[{'user_id': '47997021', 'username': '1057ezrock'}]",,,,
1243330691342962690,1243330691342962690,1585268111000,2020-03-26,20:15:11,Eastern Daylight Time,36215007,jess_mcnally,Jessica McNally,,Have a listen to @_HouseofDavid speak on @610CKTB about mental health during this pandemic! #COVID19 #COVID19Ontario #covid19Canada https://www.iheartradio.ca/610cktb/audio/covid-19-impact-on-mental-health-and-anxiety-during-pandemic-1.11186726?mode=Article …,"['_houseofdavid', '610cktb']",['https://www.iheartradio.ca/610cktb/audio/covid-19-impact-on-mental-health-and-anxiety-during-pandemic-1.11186726?mode=Article'],[],0,0,1,"['#covid19', '#covid19ontario', '#covid19canada']",[],https://twitter.com/jess_mcnally/status/1243330691342962690,False,,0,,"43.082366,-79.321248,40km",,,,,"[{'user_id': '36215007', 'username': 'jess_mcnally'}, {'user_id': '3928182857', 'username': '_HouseofDavid'}, {'user_id': '42638264', 'username': '610CKTB'}]",,,,
1243329385752596481,1243329385752596481,1585267800000,2020-03-26,20:10:00,Eastern Daylight Time,594026444,kyleysseldyk,Kyle Van Ysseldyk,,Just ordered a jigsaw puzzle and roll away mat for the puzzle. How the turntables... #COVID19 #Selfisolationgame,[],[],[],0,0,0,"['#covid19', '#selfisolationgame']",[],https://twitter.com/KyleYsseldyk/status/1243329385752596481,False,,0,,"43.082366,-79.321248,40km",,,,,"[{'user_id': '594026444', 'username': 'KyleYsseldyk'}]",,,,
1243328714835931138,1243328714835931138,1585267640000,2020-03-26,20:07:20,Eastern Daylight Time,115850425,twinkleeyes63,Deb Griffiths,,'Law & Order: SVU' Crew Member Dies at 45 Due to Coronavirus Complications  https://www.thewrap.com/law-and-order-costumer-josh-wallwork-dead-coronavirus-complications/#.Xn1DsXzjOYw.twitter …,[],['https://www.thewrap.com/law-and-order-costumer-josh-wallwork-dead-coronavirus-complications/#.Xn1DsXzjOYw.twitter'],[],0,0,0,[],[],https://twitter.com/twinkleeyes63/status/1243328714835931138,False,,0,,"43.082366,-79.321248,40km",,,,,"[{'user_id': '115850425', 'username': 'twinkleeyes63'}]",,,,
1243327726582468610,1243327726582468610,1585267404000,2020-03-26,20:03:24,Eastern Daylight Time,1022079161366728704,lynnholliday8,Lynn of the Valley,,"Covid 19. Coming to a corner near you. Before that happens, you might want to read this. Seriously consider whether there is ANYTHING you can do today, that might make a difference. Because this is where s*** is going to get real.  https://twitter.com/cmteetoprotect/status/1243255424893231111 …",[],['https://twitter.com/cmteetoprotect/status/1243255424893231111'],[],0,0,0,[],[],https://twitter.com/LynnHolliday8/status/1243327726582468610,False,https://twitter.com/cmteetoprotect/status/1243255424893231111,0,,"43.082366,-79.321248,40km",,,,,"[{'user_id': '1022079161366728704', 'username': 'LynnHolliday8'}]",,,,
1243326668284088320,1243326668284088320,1585267152000,2020-03-26,19:59:12,Eastern Daylight Time,783011754649542661,reallucababy,Lucas Spinosa (Above the Mug Podcast),,"IMPORTANT UPDATE RE. COVID-19 💥⚠️💥

The episode linked below is an update on the future of the Above the Mug podacst for the time being. We have a challenge for you that we are calling #staytheFhome 🤘

EPISODE BELOW:
 https://open.spotify.com/episode/5BKS2GOs2QPGyUkDzz3Phg?si=bz2O6neRRn64VqAbaFbFig … pic.twitter.com/uNEXA06y3V",[],['https://open.spotify.com/episode/5BKS2GOs2QPGyUkDzz3Phg?si=bz2O6neRRn64VqAbaFbFig'],['https://pbs.twimg.com/media/EUEvA2NWkAMgXBq.jpg'],0,1,2,['#staythefhome'],[],https://twitter.com/reallucababy/status/1243326668284088320,False,,0,,"43.082366,-79.321248,40km",,,,,"[{'user_id': '783011754649542661', 'username': 'reallucababy'}]",,,,
1243324834379116544,1243324834379116544,1585266715000,2020-03-26,19:51:55,Eastern Daylight Time,3861941712,neilmaha,Neil Maharaj,,"Important data underscoring the utility of #COVID19  throat swab positivity.  

1)  Narrow window to test sputum
2). Course prolonged.  Consider false negative if reasonable suspicion
3) fecal testing has an important role in situations like #2 above  https://twitter.com/FrankS1956/status/1243319833883705344 …",[],['https://twitter.com/FrankS1956/status/1243319833883705344'],[],0,0,0,['#covid19'],[],https://twitter.com/NeilMaha/status/1243324834379116544,False,https://twitter.com/FrankS1956/status/1243319833883705344,0,,"43.082366,-79.321248,40km",,,,,"[{'user_id': '3861941712', 'username': 'NeilMaha'}]",,,,
1243324454572343296,1243324454572343296,1585266624000,2020-03-26,19:50:24,Eastern Daylight Time,510208575,notlcottagerent,Maria Rekrut,,'Starting to panic': Landlords fear they won't be helped if tenants don't pay rent amid COVID-19 | CBC News  https://www.cbc.ca/news/canada/toronto/mortgages-landlords-rent-covid19-coronavirus-economy-housing-1.5508868?__vfz=medium%3Dsharebar …,[],['https://www.cbc.ca/news/canada/toronto/mortgages-landlords-rent-covid19-coronavirus-economy-housing-1.5508868?__vfz=medium%3Dsharebar'],[],0,0,0,[],[],https://twitter.com/NOTLcottagerent/status/1243324454572343296,False,,0,,"43.082366,-79.321248,40km",,,,,"[{'user_id': '510208575', 'username': 'NOTLcottagerent'}]",,,,
1243323372638998531,1243323372638998531,1585266366000,2020-03-26,19:46:06,Eastern Daylight Time,549544088,bjossee,Jossee Bedard,,"Are you kidding me @DailyMail @DailyMailUK 
NO ONE should be visiting ANYONE who hads Covid-19 , do not blame Meghan! Do you want prince harry to get it? Spread it to his child? To others? You disgust me  pic.twitter.com/xb74MqQFG8","['dailymail', 'dailymailuk']",[],['https://pbs.twimg.com/media/EUEsA4pWsAMcBND.jpg'],0,0,0,[],[],https://twitter.com/BJossee/status/1243323372638998531,False,,0,,"43.082366,-79.321248,40km",,,,,"[{'user_id': '549544088', 'username': 'BJossee'}, {'user_id': '380285402', 'username': 'DailyMail'}, {'user_id': '111556423', 'username': 'DailyMailUK'}]",,,,
1243322612018753544,1243322612018753544,1585266185000,2020-03-26,19:43:05,Eastern Daylight Time,2467484925,rachcsutherland,Rachele Sutherland,,Thank you all that help support our community. The rest of us. Please stay home. #stayhome #thankyou #covid_19 #family @ The Sutherland Team at 716 Realty Group  https://www.instagram.com/p/B-NzhggBRtj/?igshid=1720xqpsvcyhe …,[],['https://www.instagram.com/p/B-NzhggBRtj/?igshid=1720xqpsvcyhe'],[],0,0,0,"['#stayhome', '#thankyou', '#covid_19', '#family']",[],https://twitter.com/Rachcsutherland/status/1243322612018753544,False,,0,,"43.082366,-79.321248,40km",,,,,"[{'user_id': '2467484925', 'username': 'Rachcsutherland'}]",,,,
1243322510378221570,1243322510378221570,1585266160000,2020-03-26,19:42:40,Eastern Daylight Time,2803532162,da2221,Debra,,"#COVID19 #coronavirus #SocialDistancing #StayHomeCanada 🇨🇦
#WashYourHands pic.twitter.com/PoTOPa37cb",[],[],['https://pbs.twimg.com/media/EUErOveX0AEKbN-.jpg'],0,0,1,"['#covid19', '#coronavirus', '#socialdistancing', '#stayhomecanada', '#washyourhands']",[],https://twitter.com/DA2221/status/1243322510378221570,False,,0,,"43.082366,-79.321248,40km",,,,,"[{'user_id': '2803532162', 'username': 'DA2221'}]",,,,
1243321977454166016,1243321977454166016,1585266033000,2020-03-26,19:40:33,Eastern Daylight Time,1651761320,bill_standard,Bill Sawchuk,,Regional CAO said there have been intermittent problems with the phone system all week due to the volume of Covid-19 calls. The meeting had been stopped for going on the 15 minutes so far.  pic.twitter.com/yPgB6zsbjJ,[],[],['https://pbs.twimg.com/media/EUEqv1_WoAU_Yxn.jpg'],0,0,0,[],[],https://twitter.com/bill_standard/status/1243321977454166016,False,,0,,"43.082366,-79.321248,40km",,,,,"[{'user_id': '1651761320', 'username': 'bill_standard'}]",,,,
1243319371889606657,1243319371889606657,1585265412000,2020-03-26,19:30:12,Eastern Daylight Time,320754569,town_of_notl,Niagara-on-the-Lake,,"A Video Message from Lord Mayor Disero re: Coping with the Crisis  https://youtu.be/3yVTGHxNSqI . For more resources to manage your mental health during the COVID-19 pandemic, go to  http://notl.com/mental_health  pic.twitter.com/vgSoRC3AMq",[],"['https://youtu.be/3yVTGHxNSqI', 'http://notl.com/mental_health']",['https://pbs.twimg.com/media/EUEoYT-WoAAbDWW.jpg'],0,0,0,[],[],https://twitter.com/Town_of_NOTL/status/1243319371889606657,False,,0,,"43.082366,-79.321248,40km",,,,,"[{'user_id': '320754569', 'username': 'Town_of_NOTL'}]",,,,
1243318186654814208,1243318186654814208,1585265130000,2020-03-26,19:25:30,Eastern Daylight Time,21973867,judedanielle,Jude-Danielle B,,Trump is down playing the Covid-19 virus so he can make a ploy to stay president. #canadianthoughts 🤔,[],[],[],0,0,0,['#canadianthoughts'],[],https://twitter.com/JudeDanielle/status/1243318186654814208,False,,0,,"43.082366,-79.321248,40km",,,,,"[{'user_id': '21973867', 'username': 'JudeDanielle'}]",,,,
1243317974011990016,1243317974011990016,1585265079000,2020-03-26,19:24:39,Eastern Daylight Time,1004022175,nancy_crouse,Nancy Crouse,,The US has the dubious distinction of the #1 spot in the world for COVID19.  https://twitter.com/Mikeggibbs/status/1243308321433665538 …,[],['https://twitter.com/Mikeggibbs/status/1243308321433665538'],[],0,0,0,[],[],https://twitter.com/Nancy_Crouse/status/1243317974011990016,False,https://twitter.com/Mikeggibbs/status/1243308321433665538,0,,"43.082366,-79.321248,40km",,,,,"[{'user_id': '1004022175', 'username': 'Nancy_Crouse'}]",,,,
1243317155673890817,1243317155673890817,1585264884000,2020-03-26,19:21:24,Eastern Daylight Time,1004022175,nancy_crouse,Nancy Crouse,,"Not exactly the #1 spot that the US should want. 
The U.S. Now Leads the World in Confirmed Coronavirus Cases  http://a.msn.com/01/en-us/BB11LlDh?ocid=st …",[],['http://a.msn.com/01/en-us/BB11LlDh?ocid=st'],[],3,3,2,[],[],https://twitter.com/Nancy_Crouse/status/1243317155673890817,False,,0,,"43.082366,-79.321248,40km",,,,,"[{'user_id': '1004022175', 'username': 'Nancy_Crouse'}]",,,,
1243316587597348875,1243316587597348875,1585264748000,2020-03-26,19:19:08,Eastern Daylight Time,1156258842327601153,inhuisinc,Inhuis Contrived Inc. 🇨🇦 🌿,,"During the COVID-19 crisis, states are opening up online ordering and delivery options so medical patients can get …  https://www.leafly.com/news/health/covid-19-and-medical-marijuana-patients-what-you-need-to-know … pic.twitter.com/WR6PEmqWi4",[],['https://www.leafly.com/news/health/covid-19-and-medical-marijuana-patients-what-you-need-to-know'],['https://pbs.twimg.com/media/EUEl122UUAAHIIp.jpg'],0,0,0,[],[],https://twitter.com/inhuisinc/status/1243316587597348875,False,,0,,"43.082366,-79.321248,40km",,,,,"[{'user_id': '1156258842327601153', 'username': 'inhuisinc'}]",,,,
1243316216770506753,1243316216770506753,1585264660000,2020-03-26,19:17:40,Eastern Daylight Time,3291623828,gregorytrane46,Gregory Trane,,The trouble with the Coronavirus is that the intelligent people are full of doubt while the stupid people are full of confidence.,[],[],[],0,0,1,[],[],https://twitter.com/gregorytrane46/status/1243316216770506753,False,,0,,"43.082366,-79.321248,40km",,,,,"[{'user_id': '3291623828', 'username': 'gregorytrane46'}]",,,,
1243316195081834498,1243316195081834498,1585264655000,2020-03-26,19:17:35,Eastern Daylight Time,933434282927972357,darndifino,☘️ Hoof Hearted?,,Mitch McConnell blocked Democrats’ coronavirus bill for 10 days — and the press covered for him -  https://www.rawstory.com/2020/03/mitch-mcconnell-blocked-democrats-coronavirus-bill-for-10-days-and-the-press-covered-for-him/ …,[],['https://www.rawstory.com/2020/03/mitch-mcconnell-blocked-democrats-coronavirus-bill-for-10-days-and-the-press-covered-for-him/'],[],3,19,24,[],[],https://twitter.com/darndifino/status/1243316195081834498,False,,0,,"43.082366,-79.321248,40km",,,,,"[{'user_id': '933434282927972357', 'username': 'darndifino'}]",,,,
1243315725940465664,1243315725940465664,1585264543000,2020-03-26,19:15:43,Eastern Daylight Time,373077852,gregreid1,Greg Reid,,"Canada asks US not to put troops at border during coronavirus outbreak

 https://www.foxnews.com/world/canada-us-troops-border-coronavirus-outbreak …
⁦@RebelNewsOnline⁩ ...it appears the US doesn’t trust Trudeau to really close Roxham Road and other sites like it...",['rebelnewsonline'],['https://www.foxnews.com/world/canada-us-troops-border-coronavirus-outbreak'],[],0,0,0,[],[],https://twitter.com/GregReid1/status/1243315725940465664,False,,0,,"43.082366,-79.321248,40km",,,,,"[{'user_id': '373077852', 'username': 'GregReid1'}, {'user_id': '3018960919', 'username': 'RebelNewsOnline'}]",,,,
1243315571413975042,1243315571413975042,1585264506000,2020-03-26,19:15:06,Eastern Daylight Time,173866824,kellyredgar,Kelly Edgar 🇨🇦,,"Go figure... what a surprise! 

'No Canadian' trends after Donald Trump floats idea of U.S. troops at border during COVID-19 pandemic  http://ctv.news/SZ44ibF ",[],['http://ctv.news/SZ44ibF'],[],2,0,1,[],[],https://twitter.com/KellyREdgar/status/1243315571413975042,False,,0,,"43.082366,-79.321248,40km",,,,,"[{'user_id': '173866824', 'username': 'KellyREdgar'}]",,,,
1243312729298878465,1243312729298878465,1585263828000,2020-03-26,19:03:48,Eastern Daylight Time,2546258231,sabbatinisean,Sean Sabbatini,,"On March 25th at the Brock Sports Gala, via instagram live due to COVID-19, I was awarded the Joseph P. Kenny alongside fellow trainer Damian. 

My experiences in student athletic…  https://www.instagram.com/p/B-Nu-RsBDiDE62oBHtSWx9K1UwGMjA209xh9E80/?igshid=1t50f45drl5ky …",[],['https://www.instagram.com/p/B-Nu-RsBDiDE62oBHtSWx9K1UwGMjA209xh9E80/?igshid=1t50f45drl5ky'],[],0,0,1,[],[],https://twitter.com/SabbatiniSean/status/1243312729298878465,False,,0,,"43.082366,-79.321248,40km",,,,,"[{'user_id': '2546258231', 'username': 'SabbatiniSean'}]",,,,
1243312174652469249,1243312174652469249,1585263696000,2020-03-26,19:01:36,Eastern Daylight Time,1202232890,drjpricetrustee,Dr. Jason Price,,Most foolproof physical distancing strategy I have deployed  in my apartment building...excessive amounts of bad cologne. Guarantees solitary elevator rides. #coronavirus #COVID #COVIDIDIOT #COVIDCanada #COVID19BC pic.twitter.com/RzbrXfAUo2,[],[],[],0,0,0,"['#coronavirus', '#covid', '#covididiot', '#covidcanada', '#covid19bc']",[],https://twitter.com/DrJPriceTrustee/status/1243312174652469249,False,,1,,"43.082366,-79.321248,40km",,,,,"[{'user_id': '1202232890', 'username': 'DrJPriceTrustee'}]",,,,
1243311977524494338,1243311977524494338,1585263649000,2020-03-26,19:00:49,Eastern Daylight Time,1025068705993117697,corneliusecon,Cornelius Christian,,"On Tuesday, at 10am EST, I will be talking with @TradeandMoney about the economic implications of #COVID19, particularly for the United States. 

Dr. Campbell is a professor at @NES_Moscow, and was on the Council of Economic Advisors for @BarackObama. 

 https://www.youtube.com/watch?v=kJbKIV0Gxkk …","['tradeandmoney', 'nes_moscow', 'barackobama']",['https://www.youtube.com/watch?v=kJbKIV0Gxkk'],[],1,1,4,['#covid19'],[],https://twitter.com/CorneliusEcon/status/1243311977524494338,False,,0,,"43.082366,-79.321248,40km",,,,,"[{'user_id': '1025068705993117697', 'username': 'CorneliusEcon'}, {'user_id': '42955171', 'username': 'TradeandMoney'}, {'user_id': '163995258', 'username': 'NES_Moscow'}, {'user_id': '813286', 'username': 'BarackObama'}]",,,,
1243311937116651520,1243311937116651520,1585263640000,2020-03-26,19:00:40,Eastern Daylight Time,278206598,townoflincolnon,TownofLincoln,,ATTN NIAGARA BUSINESSES: Niagara’s Economic Rapid Response Team is asking all Niagara businesses to take part in Niagara’s COVID-19 Business Impact Survey to help us document and inform support for our business community. Visit  http://ow.ly/Ftoh50yRBok  to take the survey pic.twitter.com/ctVLJOiCs0,[],['http://ow.ly/Ftoh50yRBok'],['https://pbs.twimg.com/media/EUEhnj6X0AQ7lsW.jpg'],0,1,1,[],[],https://twitter.com/TownofLincolnON/status/1243311937116651520,False,,0,,"43.082366,-79.321248,40km",,,,,"[{'user_id': '278206598', 'username': 'TownofLincolnON'}]",,,,
1243308229184163840,1243308229184163840,1585262756000,2020-03-26,18:45:56,Eastern Daylight Time,391561525,jclark1360,James Clark,,So now Trump wants to put the military on the border between Canada and the US. It’s ironic because the last thing we want in Canada is US citizens visiting us. The US is now the COVID 19 epicentre of the world. Stay home. We don’t want you here.,[],[],[],0,0,0,[],[],https://twitter.com/jclark1360/status/1243308229184163840,False,,0,,"43.082366,-79.321248,40km",,,,,"[{'user_id': '391561525', 'username': 'jclark1360'}]",,,,
1243307995259428865,1243307995259428865,1585262700000,2020-03-26,18:45:00,Eastern Daylight Time,3153966970,investinstc,InvestinSTC,,"How is COVID-19 affecting your business? Niagara’s Economic Rapid Response Team needs your input as we gather data to send directly to the provincial and federal governments.

Take the survey here:   https://ca.surveygizmo.com/s3/50071645/Niagara-COVID-19-Business-Impact-Survey …
#NiagaraERRT #STCRRT #COVID19  pic.twitter.com/iHIyv2s7re",[],['https://ca.surveygizmo.com/s3/50071645/Niagara-COVID-19-Business-Impact-Survey'],['https://pbs.twimg.com/media/EUCbl3KXQAIvQUC.jpg'],0,0,0,"['#niagaraerrt', '#stcrrt', '#covid19']",[],https://twitter.com/InvestinSTC/status/1243307995259428865,False,,0,,"43.082366,-79.321248,40km",,,,,"[{'user_id': '3153966970', 'username': 'InvestinSTC'}]",,,,
1243307844339765250,1243307844339765250,1585262664000,2020-03-26,18:44:24,Eastern Daylight Time,1202232890,drjpricetrustee,Dr. Jason Price,,The U.S. Now Leads the World in Confirmed Coronavirus Cases  http://a.msn.com/01/en-us/BB11LlDh?ocid=st2 …,[],['http://a.msn.com/01/en-us/BB11LlDh?ocid=st2'],[],0,0,0,[],[],https://twitter.com/DrJPriceTrustee/status/1243307844339765250,False,,0,,"43.082366,-79.321248,40km",,,,,"[{'user_id': '1202232890', 'username': 'DrJPriceTrustee'}]",,,,
1243307347918958594,1243306793989804032,1585262545000,2020-03-26,18:42:25,Eastern Daylight Time,390284252,marytcdnchick,Mary Towndrow,,Does one want bed bugs after either a brutal and exhausting day in the ER or while trying to recover from COVID-19?!?,"['themaxburns', 'realdonaldtrump']",[],[],0,0,0,[],[],https://twitter.com/marytcdnchick/status/1243307347918958594,False,,0,,"43.082366,-79.321248,40km",,,,,"[{'user_id': '390284252', 'username': 'marytcdnchick'}, {'user_id': '1599266138', 'username': 'themaxburns'}, {'user_id': '25073877', 'username': 'realDonaldTrump'}]",,,,
1243306758971494400,1243306758971494400,1585262405000,2020-03-26,18:40:05,Eastern Daylight Time,2440409464,sghickster,Shawn Chickowski🎸,,"@DrPhil I have heard a statistic that one person can infect up to 59,000 people if it changed hands 10 times. Influenza would infect 15 people in the same manner #COVID19",['drphil'],[],[],0,0,0,['#covid19'],[],https://twitter.com/sghickster/status/1243306758971494400,False,,0,,"43.082366,-79.321248,40km",,,,,"[{'user_id': '2440409464', 'username': 'sghickster'}, {'user_id': '7025662', 'username': 'DrPhil'}]",,,,
1243306094384070662,1243306094384070662,1585262247000,2020-03-26,18:37:27,Eastern Daylight Time,278840984,trashbarwelland,G Boz,,"I got a beef. Why's everybody driving so fast right now? Like, where have you got to be? Nothing's happening, nothing needs to happen, take er easy and enjoy the ride. #COVID19",[],[],[],0,0,3,['#covid19'],[],https://twitter.com/TrashBarWelland/status/1243306094384070662,False,,0,,"43.082366,-79.321248,40km",,,,,"[{'user_id': '278840984', 'username': 'TrashBarWelland'}]",,,,
1243305378630287372,1243305378630287372,1585262076000,2020-03-26,18:34:36,Eastern Daylight Time,1013855938967736328,gordhoward,Gord Howard,,Stores learning to manage crowds amid COVID-19 outbreak  https://www.stcatharinesstandard.ca/news-story/9917332-stores-learning-to-manage-crowds-amid-covid-19-outbreak/#.Xn0t9xkiAIs.twitter …,[],['https://www.stcatharinesstandard.ca/news-story/9917332-stores-learning-to-manage-crowds-amid-covid-19-outbreak/#.Xn0t9xkiAIs.twitter'],[],0,1,0,[],[],https://twitter.com/GordHoward/status/1243305378630287372,False,,0,,"43.082366,-79.321248,40km",,,,,"[{'user_id': '1013855938967736328', 'username': 'GordHoward'}]",,,,
1243305110001733632,1243305110001733632,1585262012000,2020-03-26,18:33:32,Eastern Daylight Time,181621650,spottykips,Spotty Kips,,Isolation animals: How Eve the cat is helping this Aucklander get through coronavirus lockdown  http://dlvr.it/RSdKfK ,[],['http://dlvr.it/RSdKfK'],[],0,0,0,[],[],https://twitter.com/spottykips/status/1243305110001733632,False,,0,,"43.082366,-79.321248,40km",,,,,"[{'user_id': '181621650', 'username': 'spottykips'}]",,,,
1243304486514417664,1243301777614798848,1585261863000,2020-03-26,18:31:03,Eastern Daylight Time,387536554,1930goalie,Dave,,Stomp on that coronavirus bug,"['hunternyc_', 'bootsubryan']",[],[],0,0,1,[],[],https://twitter.com/1930goalie/status/1243304486514417664,False,,0,,"43.082366,-79.321248,40km",,,,,"[{'user_id': '387536554', 'username': '1930goalie'}, {'user_id': '1156281993623220225', 'username': 'hunternyc_'}, {'user_id': '1077210672998559744', 'username': 'bootsubryan'}]",,,,
