id,conversation_id,created_at,date,time,timezone,user_id,username,name,place,tweet,mentions,urls,photos,replies_count,retweets_count,likes_count,hashtags,cashtags,link,retweet,quote_url,video,near,geo,source,user_rt_id,user_rt,retweet_id,reply_to,retweet_date,translate,trans_src,trans_dest
1243246136871313408,1243246136871313408,1585247952000,2020-03-26,14:39:12,Eastern Daylight Time,264354845,the_gncc,The Greater Niagara Chamber of Commerce,,"We're looking to the business community to provide insight on the impacts of COVID-19. Please fill out this short survey to help inform recovery planning and supports for Niagara's business community. Closing date will be Monday at 4pm.
 https://hubs.ly/H0nWp0m0  pic.twitter.com/7jGHoYKN2r",[],['https://hubs.ly/H0nWp0m0'],['https://pbs.twimg.com/media/EUDlxewXgAEdlv-.jpg'],0,4,0,[],[],https://twitter.com/the_GNCC/status/1243246136871313408,False,,0,,"43.082366,-79.321248,40km",,,,,"[{'user_id': '264354845', 'username': 'the_GNCC'}]",,,,
1243246033502703618,1243246033502703618,1585247927000,2020-03-26,14:38:47,Eastern Daylight Time,963526141,yourtvniagara,YourTV Niagara,,An information line has been opened providing support to Ontario businesses who have questions about the emergency order to close at-risk workplaces due to #COVID19 . Do you have questions? Call 1-888-444-3659 #stopthespread #covidontario,[],[],[],0,0,0,"['#covid19', '#stopthespread', '#covidontario']",[],https://twitter.com/yourtvniagara/status/1243246033502703618,False,,0,,"43.082366,-79.321248,40km",,,,,"[{'user_id': '963526141', 'username': 'yourtvniagara'}]",,,,
1243243978545401862,1243243978545401862,1585247437000,2020-03-26,14:30:37,Eastern Daylight Time,18652644,pearldragon,💔#savethegrandparents 💔,,New York's coronavirus death toll jumps 100 in just one day to 385  https://nypost.com/2020/03/26/new-yorks-coronavirus-death-toll-jumps-100-in-just-one-day-to-385/?utm_source=twitter_sitebuttons&utm_medium=site%20buttons&utm_campaign=site%20buttons … via @nypmetro,['nypmetro'],['https://nypost.com/2020/03/26/new-yorks-coronavirus-death-toll-jumps-100-in-just-one-day-to-385/?utm_source=twitter_sitebuttons&utm_medium=site%20buttons&utm_campaign=site%20buttons'],[],0,0,0,[],[],https://twitter.com/pearldragon/status/1243243978545401862,False,,0,,"43.082366,-79.321248,40km",,,,,"[{'user_id': '18652644', 'username': 'pearldragon'}, {'user_id': '1158638582', 'username': 'nypmetro'}]",,,,
1243242555598417920,1243242555598417920,1585247098000,2020-03-26,14:24:58,Eastern Daylight Time,1004022175,nancy_crouse,Nancy Crouse,,"I guess I'll be sending my buddy to The Barrel for italian food and wine.
Coronavirus: Liquor licensed Ontario bars, restaurants can sell alcohol with takeout and delivery food |  http://Globalnews.ca  https://globalnews.ca/news/6736045/ontario-liquor-licensed-bars-restaurants-sell-alcohol-takeout-delivery-coronavirus/ …",[],"['http://Globalnews.ca', 'https://globalnews.ca/news/6736045/ontario-liquor-licensed-bars-restaurants-sell-alcohol-takeout-delivery-coronavirus/']",[],0,1,1,[],[],https://twitter.com/Nancy_Crouse/status/1243242555598417920,False,,0,,"43.082366,-79.321248,40km",,,,,"[{'user_id': '1004022175', 'username': 'Nancy_Crouse'}]",,,,
1243242531451801606,1243242531451801606,1585247092000,2020-03-26,14:24:52,Eastern Daylight Time,1643503944,tomkubow,Tom Kubow,,"Worldwide coronavirus cases top 500,000, doubling in just over a week. #USA has the third highest cases of #COVID19 in the world and ⁦@realDonaldTrump⁩ #whitehouse says we have it under control. Thank god we closed the border before it was too late https://flip.it/oYaJd9 ",['realdonaldtrump'],['https://flip.it/oYaJd9'],[],0,0,0,"['#usa', '#covid19', '#whitehouse']",[],https://twitter.com/tomkubow/status/1243242531451801606,False,,0,,"43.082366,-79.321248,40km",,,,,"[{'user_id': '1643503944', 'username': 'tomkubow'}, {'user_id': '25073877', 'username': 'realDonaldTrump'}]",,,,
1243241562215251969,1243241562215251969,1585246861000,2020-03-26,14:21:01,Eastern Daylight Time,1054413888786186241,susan25823812,Mobile Funnels,,Some Google My Business Features Temporarily Limited Due To COVID-19  https://wersm.com/some-google-my-business-features-temporarily-limited-due-to-covid-19/ … pic.twitter.com/WlfefF4Cjy,[],['https://wersm.com/some-google-my-business-features-temporarily-limited-due-to-covid-19/'],['https://pbs.twimg.com/media/EUDhnLCXkAAFcua.jpg'],0,0,0,[],[],https://twitter.com/Susan25823812/status/1243241562215251969,False,,0,,"43.082366,-79.321248,40km",,,,,"[{'user_id': '1054413888786186241', 'username': 'Susan25823812'}]",,,,
1243241144923893761,1243241144923893761,1585246761000,2020-03-26,14:19:21,Eastern Daylight Time,73137868,cdnmusician,Canadian Musician Magazine,,"Erin Benjamin of the @Canadian_Live Music Association joins us on the pod to discuss the impacts of the COVID-19 pandemic on our live music sector.

Get it at  http://www.canadianmusicianpodcast.com  or wherever you listen! pic.twitter.com/CrNJYVvPVz",['canadian_live'],['http://www.canadianmusicianpodcast.com'],['https://pbs.twimg.com/media/EUDhHFnWkAA1ZWO.jpg'],0,6,5,[],[],https://twitter.com/cdnmusician/status/1243241144923893761,False,,0,,"43.082366,-79.321248,40km",,,,,"[{'user_id': '73137868', 'username': 'cdnmusician'}, {'user_id': '2437011894', 'username': 'Canadian_Live'}]",,,,
1243240889012695041,1243240889012695041,1585246700000,2020-03-26,14:18:20,Eastern Daylight Time,239289284,pooochy21,poochy,,Andrew M. Cuomo: NEW YORK STATE GIVE CORRECTION OFFICER'S MASKS for COVID19! - Sign the Petition!  http://chng.it/yQYBzS74  via @Change,['change'],['http://chng.it/yQYBzS74'],[],0,0,0,[],[],https://twitter.com/pooochy21/status/1243240889012695041,False,,0,,"43.082366,-79.321248,40km",,,,,"[{'user_id': '239289284', 'username': 'pooochy21'}, {'user_id': '15947602', 'username': 'Change'}]",,,,
1243240166342266880,1243240166342266880,1585246528000,2020-03-26,14:15:28,Eastern Daylight Time,1004022175,nancy_crouse,Nancy Crouse,,"""PM says Canadians should be wary of thieves looking to prey on people during pandemic""
Trudeau warns of COVID-19 text scam exploiting new emergency benefit program | CBC News  https://www.cbc.ca/news/politics/trudeau-g20-covid-19-1.5510529?__vfz=medium%3Dsharebar …",[],['https://www.cbc.ca/news/politics/trudeau-g20-covid-19-1.5510529?__vfz=medium%3Dsharebar'],[],0,1,3,[],[],https://twitter.com/Nancy_Crouse/status/1243240166342266880,False,,0,,"43.082366,-79.321248,40km",,,,,"[{'user_id': '1004022175', 'username': 'Nancy_Crouse'}]",,,,
1243240018610737152,1243240018610737152,1585246493000,2020-03-26,14:14:53,Eastern Daylight Time,960541112590065664,downtownbench,Downtown Bench Beamsville,,"The @Ont_AGCO announced a number of temporary measures to support #Ontarians & businesses that have impacted by the spread of COVID-19. Effective immediately, licensed restaurants & bars in Ontario may sell alcohol with food takeout & delivery. Learn more:  https://www.agco.ca/ontario-adopts-temporary-measures-support-bars-restaurants-and-alcohol-retailers-during-covid-19 …",['ont_agco'],['https://www.agco.ca/ontario-adopts-temporary-measures-support-bars-restaurants-and-alcohol-retailers-during-covid-19'],[],0,1,0,['#ontarians'],[],https://twitter.com/downtownbench/status/1243240018610737152,False,,0,,"43.082366,-79.321248,40km",,,,,"[{'user_id': '960541112590065664', 'username': 'downtownbench'}, {'user_id': '3836434883', 'username': 'Ont_AGCO'}]",,,,
1243239722794786816,1243239722794786816,1585246422000,2020-03-26,14:13:42,Eastern Daylight Time,1004022175,nancy_crouse,Nancy Crouse,,"Perhaps Canada should deploy our military at the border too.
Coronavirus death toll in U.S. now more than 1,000 | CBC News  https://www.cbc.ca/news/world/us-coronavirus-thursday-1.5510581?__vfz=medium%3Dsharebar …",[],['https://www.cbc.ca/news/world/us-coronavirus-thursday-1.5510581?__vfz=medium%3Dsharebar'],[],2,1,4,[],[],https://twitter.com/Nancy_Crouse/status/1243239722794786816,False,,0,,"43.082366,-79.321248,40km",,,,,"[{'user_id': '1004022175', 'username': 'Nancy_Crouse'}]",,,,
1243238760160116742,1243238760160116742,1585246193000,2020-03-26,14:09:53,Eastern Daylight Time,1625616512,chasecandace1,Candace Stern,,Haldimand tightens COVID-19 response: Volunteers needed to support communities during pandemic #news https://pb.fyi/6vUn ,[],['https://pb.fyi/6vUn'],[],0,0,0,['#news'],[],https://twitter.com/chasecandace1/status/1243238760160116742,False,,0,,"43.082366,-79.321248,40km",,,,,"[{'user_id': '1625616512', 'username': 'chasecandace1'}]",,,,
1243238708561825792,1243238708561825792,1585246181000,2020-03-26,14:09:41,Eastern Daylight Time,788267065174028288,theaction716,The Action Niagara Falls,,"WEST SENECA: Buffalo man coughs in officer's face, says he has coronavirus  http://ow.ly/JzrN30qsWDQ ",[],['http://ow.ly/JzrN30qsWDQ'],[],1,4,7,[],[],https://twitter.com/TheAction716/status/1243238708561825792,False,,0,,"43.082366,-79.321248,40km",,,,,"[{'user_id': '788267065174028288', 'username': 'TheAction716'}]",,,,
1243238037779296257,1243238037779296257,1585246021000,2020-03-26,14:07:01,Eastern Daylight Time,33069568,jeff_bennett,Jeff Bennett,,How deadly is the coronavirus? It's still far from clear  https://www.spectator.co.uk/article/The-evidence-on-Covid-19-is-not-as-clear-as-we-think … via @spectator,['spectator'],['https://www.spectator.co.uk/article/The-evidence-on-Covid-19-is-not-as-clear-as-we-think'],[],0,0,0,[],[],https://twitter.com/jeff_bennett/status/1243238037779296257,False,,0,,"43.082366,-79.321248,40km",,,,,"[{'user_id': '33069568', 'username': 'jeff_bennett'}, {'user_id': '16683666', 'username': 'spectator'}]",,,,
1243237956468555776,1243236609031581696,1585246001000,2020-03-26,14:06:41,Eastern Daylight Time,51311437,aaronbesecker,Aaron Besecker,,"Niagara County climbs to 19 total positive Covid-19 cases, Director of Public Health Dan Stapleton says",[],[],[],2,0,0,[],[],https://twitter.com/AaronBesecker/status/1243237956468555776,False,,0,,"43.082366,-79.321248,40km",,,,,"[{'user_id': '51311437', 'username': 'AaronBesecker'}]",,,,
1243237196917805057,1243235681566183424,1585245820000,2020-03-26,14:03:40,Eastern Daylight Time,1220020858598645762,coach_leo_,Coach Leo ⚾️,,"Is there anything the NCAA will do for volunteer coaches who have lost all their camps, lessons and youth practices due to COVID19 ? Many of us are without pay or benefits now, with minimal to no relief in site. Any chance this will push the paid assistant vote through ?",['kendallrogers'],[],[],2,0,6,[],[],https://twitter.com/Coach_Leo_/status/1243237196917805057,False,,0,,"43.082366,-79.321248,40km",,,,,"[{'user_id': '1220020858598645762', 'username': 'Coach_Leo_'}, {'user_id': '65067637', 'username': 'KendallRogers'}]",,,,
1243236952838737922,1243236952838737922,1585245762000,2020-03-26,14:02:42,Eastern Daylight Time,2402213695,greenmclovin,Niko 905,,Just think about what the idiots were doing 11 days ago. Shit might get really real here this weekend. #coronavirus,[],[],[],0,0,1,['#coronavirus'],[],https://twitter.com/GreenMcLovin/status/1243236952838737922,False,,0,,"43.082366,-79.321248,40km",,,,,"[{'user_id': '2402213695', 'username': 'GreenMcLovin'}]",,,,
1243236896563757058,1243236896563757058,1585245749000,2020-03-26,14:02:29,Eastern Daylight Time,2327118996,grimsbyyoga,Grimsby Yoga,,"COVID-19 Online Yoga Challenge
Week 1 Draw Winners:
Kellie Woolley - 1 free week of Yoga ($40 value) courtesy of @GrimsbyYoga 
Kathleen Gilchrist - gift card ($10 value)
courtesy of Urban Cravings 
Jenn McDonald - gift certificate ($50 value) courtesy of Jackie O's Boutique 
❤😘 pic.twitter.com/K4aMllVWPU",['grimsbyyoga'],[],['https://pbs.twimg.com/media/EUDdXJwWsAAxEUm.jpg'],0,0,0,[],[],https://twitter.com/GrimsbyYoga/status/1243236896563757058,False,,0,,"43.082366,-79.321248,40km",,,,,"[{'user_id': '2327118996', 'username': 'GrimsbyYoga'}]",,,,
1243236609031581696,1243236609031581696,1585245680000,2020-03-26,14:01:20,Eastern Daylight Time,51311437,aaronbesecker,Aaron Besecker,,Niagara County scheduled to issue 2pm update on Covid-19 outbreak. Just started...,[],[],[],1,0,0,[],[],https://twitter.com/AaronBesecker/status/1243236609031581696,False,,0,,"43.082366,-79.321248,40km",,,,,"[{'user_id': '51311437', 'username': 'AaronBesecker'}]",,,,
1243236324443860993,1243236324443860993,1585245612000,2020-03-26,14:00:12,Eastern Daylight Time,54564544,townofforterie,Town of Fort Erie,,"For the next little while, the Town of Fort Erie will be providing a Community Update on Thursday afternoons regarding its efforts to combat the COVID-19 virus. This week's update features a message from Mayor Wayne Redekop -  https://bit.ly/2WKN9GR  #StayHomeNiagara pic.twitter.com/qQ8qdPyMxD",[],['https://bit.ly/2WKN9GR'],['https://pbs.twimg.com/media/EUDc2JOXQAMw1wG.jpg'],0,0,0,['#stayhomeniagara'],[],https://twitter.com/TownOfFortErie/status/1243236324443860993,False,,0,,"43.082366,-79.321248,40km",,,,,"[{'user_id': '54564544', 'username': 'TownOfFortErie'}]",,,,
1243235889171611649,1243219538562482177,1585245508000,2020-03-26,13:58:28,Eastern Daylight Time,950781771771203584,johnperkins33,John Perkins,,So the other 6500 quit dying? This COVID-19 is great for saving lives,"['rudygiuliani', 'realcandaceo']",[],[],0,0,0,[],[],https://twitter.com/JohnPerkins33/status/1243235889171611649,False,,0,,"43.082366,-79.321248,40km",,,,,"[{'user_id': '950781771771203584', 'username': 'JohnPerkins33'}, {'user_id': '770781940341288960', 'username': 'RudyGiuliani'}, {'user_id': '878247600096509952', 'username': 'RealCandaceO'}]",,,,
1243235158964211713,1243235158964211713,1585245334000,2020-03-26,13:55:34,Eastern Daylight Time,183726524,vick_elizabethg,vick,,If covid-19 ruins my birthday I am having 2 next year and you CAN’T STOP ME.,[],[],[],0,0,0,[],[],https://twitter.com/vick_elizabethg/status/1243235158964211713,False,,0,,"43.082366,-79.321248,40km",,,,,"[{'user_id': '183726524', 'username': 'vick_elizabethg'}]",,,,
1243234607878807554,1243233807794225153,1585245203000,2020-03-26,13:53:23,Eastern Daylight Time,50508381,ungerkyle,Kyle Unger,,This movie is SO GOOOOD. If we had Hulu in Canada I’d be watching it on repeat until COVID-19 went away.,['emmykegler'],[],[],0,0,0,[],[],https://twitter.com/ungerkyle/status/1243234607878807554,False,,0,,"43.082366,-79.321248,40km",,,,,"[{'user_id': '50508381', 'username': 'ungerkyle'}, {'user_id': '17535445', 'username': 'emmykegler'}]",,,,
1243233985821585413,1243233985821585413,1585245055000,2020-03-26,13:50:55,Eastern Daylight Time,260747015,littlesunray73,Melissa Rodeffer,,PSA Safe Grocery Shopping in COVID-19 Pandemic – UPDATED!!!  https://youtu.be/sjDuwc9KBps  via @YouTube,['youtube'],['https://youtu.be/sjDuwc9KBps'],[],0,0,0,[],[],https://twitter.com/littlesunray73/status/1243233985821585413,False,,0,,"43.082366,-79.321248,40km",,,,,"[{'user_id': '260747015', 'username': 'littlesunray73'}, {'user_id': '10228272', 'username': 'YouTube'}]",,,,
1243233825578266626,1243233825578266626,1585245016000,2020-03-26,13:50:16,Eastern Daylight Time,963526141,yourtvniagara,YourTV Niagara,,"The Ontario Govt is providing $1.9B in financial relief to reduce the financial strain on businesses due to #COVID19. Learn more here:  https://bit.ly/3dzfXIi 
#cdnpoli #covidontario",[],['https://bit.ly/3dzfXIi'],[],0,0,0,"['#covid19', '#cdnpoli', '#covidontario']",[],https://twitter.com/yourtvniagara/status/1243233825578266626,False,,0,,"43.082366,-79.321248,40km",,,,,"[{'user_id': '963526141', 'username': 'yourtvniagara'}]",,,,
1243233583629811714,1243233583629811714,1585244959000,2020-03-26,13:49:19,Eastern Daylight Time,47997021,1057ezrock,105.7 EZ Rock,,"So.... there's a #covid19 related text scam now, if you receive one DO NOT click the link. 

The alert looks something like this ""Alert: The emergency response benefit of Canada relief fund has sent you a deposit for $1375.50. See [insert link here]. Data rates may apply.""",[],[],[],0,3,0,['#covid19'],[],https://twitter.com/1057ezrock/status/1243233583629811714,False,,0,,"43.082366,-79.321248,40km",,,,,"[{'user_id': '47997021', 'username': '1057ezrock'}]",,,,
1243232520918962184,1243232520918962184,1585244705000,2020-03-26,13:45:05,Eastern Daylight Time,102556875,niagaragazette,Niagara Gazette,,"Hockey equipment manufacturer Bauer has shifted from making visors for helmets to medical visors for those fighting the coronavirus pandemic.
 https://www.niagara-gazette.com/covid-19/hockey-equipment-maker-bauer-shifts-to-medical-shields/article_03c0e7a6-6f84-11ea-a0fb-5377740b0431.html … pic.twitter.com/wnTkDMq9lc",[],['https://www.niagara-gazette.com/covid-19/hockey-equipment-maker-bauer-shifts-to-medical-shields/article_03c0e7a6-6f84-11ea-a0fb-5377740b0431.html'],['https://pbs.twimg.com/media/EUDZYu5XsAAvnkS.jpg'],0,1,6,[],[],https://twitter.com/NiagaraGazette/status/1243232520918962184,False,,0,,"43.082366,-79.321248,40km",,,,,"[{'user_id': '102556875', 'username': 'NiagaraGazette'}]",,,,
1243232396394352642,1243232396394352642,1585244676000,2020-03-26,13:44:36,Eastern Daylight Time,34732828,niafallsreview,Niagara Falls Review,,BREAKING: Two new COVID-19 cases in Niagara  https://www.niagarafallsreview.ca/news-story/9916647-breaking-two-new-covid-19-cases-in-niagara/#.XnzqArewg0E.twitter …,[],['https://www.niagarafallsreview.ca/news-story/9916647-breaking-two-new-covid-19-cases-in-niagara/#.XnzqArewg0E.twitter'],[],0,2,0,[],[],https://twitter.com/NiaFallsReview/status/1243232396394352642,False,,0,,"43.082366,-79.321248,40km",,,,,"[{'user_id': '34732828', 'username': 'NiaFallsReview'}]",,,,
1243231762840530944,1243231762840530944,1585244525000,2020-03-26,13:42:05,Eastern Daylight Time,35732020,jason_clements,Jason Clements,,The coronavirus is not fake news. Please stay home and self isolate so we can flatten the curve.  https://twitter.com/HamillHimself/status/1242969360181776385 …,[],['https://twitter.com/HamillHimself/status/1242969360181776385'],[],0,0,0,[],[],https://twitter.com/jason_clements/status/1243231762840530944,False,https://twitter.com/HamillHimself/status/1242969360181776385,0,,"43.082366,-79.321248,40km",,,,,"[{'user_id': '35732020', 'username': 'jason_clements'}]",,,,
1243231463853699074,1243231463853699074,1585244453000,2020-03-26,13:40:53,Eastern Daylight Time,46671595,dgalipeau,Derek Galipeau,,"Captain Positive: René Galipeau was living with brain cancer, then he contracted COVID-19  http://nationalpost.com/wcm/81992521-f184-4993-bdf3-905cb2096d3a … via @nationalpost",['nationalpost'],['http://nationalpost.com/wcm/81992521-f184-4993-bdf3-905cb2096d3a'],[],1,0,4,[],[],https://twitter.com/dgalipeau/status/1243231463853699074,False,,0,,"43.082366,-79.321248,40km",,,,,"[{'user_id': '46671595', 'username': 'dgalipeau'}, {'user_id': '14216661', 'username': 'nationalpost'}]",,,,
1243230330426986497,1243230330426986497,1585244183000,2020-03-26,13:36:23,Eastern Daylight Time,165833151,stiflerjohnson,robin johnson 🇺🇬🇨🇦,,🤣🤣🤣🤣 Must watch .. COVID 19 is here. #GOT #GameOfThronesImpressions #COVID2019 pic.twitter.com/MwYRfkD5cX,[],[],[],0,0,0,"['#got', '#gameofthronesimpressions', '#covid2019']",[],https://twitter.com/stiflerjohnson/status/1243230330426986497,False,,1,,"43.082366,-79.321248,40km",,,,,"[{'user_id': '165833151', 'username': 'stiflerjohnson'}]",,,,
1243229916201705472,1243229916201705472,1585244084000,2020-03-26,13:34:44,Eastern Daylight Time,1228464733176651782,_tadexoxo,AkubeBoyfriend,,Person wey Dey sell Hand sanitizer has been tested positive for #COVID19 🤥,[],[],[],0,0,2,['#covid19'],[],https://twitter.com/_tadexoxo/status/1243229916201705472,False,,0,,"43.082366,-79.321248,40km",,,,,"[{'user_id': '1228464733176651782', 'username': '_tadexoxo'}]",,,,
1243229052535799810,1243229052535799810,1585243878000,2020-03-26,13:31:18,Eastern Daylight Time,552989840,tyler_ludwig,Tyler Ludwig,,Cuomo is a terrible governor but I’ll give him props on his leadership during this COVID-19 crisis 🤔,[],[],[],2,0,10,[],[],https://twitter.com/Tyler_Ludwig/status/1243229052535799810,False,,0,,"43.082366,-79.321248,40km",,,,,"[{'user_id': '552989840', 'username': 'Tyler_Ludwig'}]",,,,
1243228842187280384,1243228842187280384,1585243828000,2020-03-26,13:30:28,Eastern Daylight Time,963526141,yourtvniagara,YourTV Niagara,,"Premier Doug Ford has just announced an additional $3.3B to Frontline Health Care in response to #COVID19. This funding will add more protective equipment, testing, and beds. Learn more about Ontario's Action Plan here:  https://bit.ly/2y6fehz ",[],['https://bit.ly/2y6fehz'],[],0,1,0,['#covid19'],[],https://twitter.com/yourtvniagara/status/1243228842187280384,False,,0,,"43.082366,-79.321248,40km",,,,,"[{'user_id': '963526141', 'username': 'yourtvniagara'}]",,,,
1243228438376452096,1243228438376452096,1585243732000,2020-03-26,13:28:52,Eastern Daylight Time,18121304,becksls30,🎉Becky🎉,,Wegmans and Tops Installing Shields at Registers Due To Coronavirus Pandemic  http://wyrk.com/wegmans-and-tops-installing-shields-at-registers-due-to-coronavirus-pandemic/?trackback=twitter_mobile … @1065wyrk,['1065wyrk'],['http://wyrk.com/wegmans-and-tops-installing-shields-at-registers-due-to-coronavirus-pandemic/?trackback=twitter_mobile'],[],0,0,2,[],[],https://twitter.com/BecksLS30/status/1243228438376452096,False,,0,,"43.082366,-79.321248,40km",,,,,"[{'user_id': '18121304', 'username': 'BecksLS30'}, {'user_id': '15137073', 'username': '1065WYRK'}]",,,,
1243227902554116096,1243227902554116096,1585243604000,2020-03-26,13:26:44,Eastern Daylight Time,1004022175,nancy_crouse,Nancy Crouse,,Especially now. The US is the hot spot for COVID19.  https://twitter.com/wendy_sherwood/status/1243225187035664384 …,[],['https://twitter.com/wendy_sherwood/status/1243225187035664384'],[],0,0,2,[],[],https://twitter.com/Nancy_Crouse/status/1243227902554116096,False,https://twitter.com/wendy_sherwood/status/1243225187035664384,0,,"43.082366,-79.321248,40km",,,,,"[{'user_id': '1004022175', 'username': 'Nancy_Crouse'}]",,,,
1243227464580636672,1243227464580636672,1585243500000,2020-03-26,13:25:00,Eastern Daylight Time,123257433,st_catharines,St. Catharines,,"📞A reminder that Mayor @WSendzik will be calling residents with an automated message in response to COVID-19. 
Help #FlattenTheCurve and remember we're #AllInThisTogether pic.twitter.com/gsaqjoR8wX",['wsendzik'],[],['https://pbs.twimg.com/media/EUDP5RXXkAMvDyi.jpg'],0,7,8,"['#flattenthecurve', '#allinthistogether']",[],https://twitter.com/St_Catharines/status/1243227464580636672,False,,0,,"43.082366,-79.321248,40km",,,,,"[{'user_id': '123257433', 'username': 'St_Catharines'}, {'user_id': '31549980', 'username': 'WSendzik'}]",,,,
1243227311555649538,1243227311555649538,1585243463000,2020-03-26,13:24:23,Eastern Daylight Time,114960363,maoistrebelnews,Jason Unruhe☭,,Hospitals consider universal do-not-resuscitate orders for coronavirus patients   https://www.washingtonpost.com/health/2020/03/25/coronavirus-patients-do-not-resucitate/ …,[],['https://www.washingtonpost.com/health/2020/03/25/coronavirus-patients-do-not-resucitate/'],[],1,1,0,[],[],https://twitter.com/MaoistRebelNews/status/1243227311555649538,False,,0,,"43.082366,-79.321248,40km",,,,,"[{'user_id': '114960363', 'username': 'MaoistRebelNews'}]",,,,
1243226462083264513,1243226462083264513,1585243261000,2020-03-26,13:21:01,Eastern Daylight Time,738018000,emilyyx0x0x,Emilyy⚓,,I'm seeing dogs in the neighbourhood that I never knew existed..I just wanna pet them all :( stupid covid-19 #SocialDistance #COVID19 #QuarantineLife,[],[],[],0,0,0,"['#socialdistance', '#covid19', '#quarantinelife']",[],https://twitter.com/Emilyyx0x0x/status/1243226462083264513,False,,0,,"43.082366,-79.321248,40km",,,,,"[{'user_id': '738018000', 'username': 'Emilyyx0x0x'}]",,,,
1243224897897279488,1243224897897279488,1585242888000,2020-03-26,13:14:48,Eastern Daylight Time,1879816080,abritoverseas,Nigel Hay,,"I expect to see a big military build up around Fort Erie, Buffalo, & Niagara Falls 
US cases are spiraling out of control.
Deputy PM can't give a straight answer!

#coronavirus",[],[],[],0,0,0,['#coronavirus'],[],https://twitter.com/ABritoverseas/status/1243224897897279488,False,,0,,"43.082366,-79.321248,40km",,,,,"[{'user_id': '1879816080', 'username': 'ABritoverseas'}]",,,,
1243224822689259522,1243224822689259522,1585242870000,2020-03-26,13:14:30,Eastern Daylight Time,261872885,mfraiman,Michael Fraiman,,Wait a second. Christians are immune to #COVID19?!  https://twitter.com/RightWingWatch/status/1243190357418008576 …,[],['https://twitter.com/RightWingWatch/status/1243190357418008576'],[],0,0,0,['#covid19'],[],https://twitter.com/MFraiman/status/1243224822689259522,False,https://twitter.com/RightWingWatch/status/1243190357418008576,0,,"43.082366,-79.321248,40km",,,,,"[{'user_id': '261872885', 'username': 'MFraiman'}]",,,,
1243224782956638209,1243224782956638209,1585242860000,2020-03-26,13:14:20,Eastern Daylight Time,3292901241,agingophelia,Aging Ophelia,,Managing Chronic Illnesses During the COVID-19 Pandemic  https://themighty.com/2020/03/managing-chronic-illnesses-covid-19-pandemic/ …,[],['https://themighty.com/2020/03/managing-chronic-illnesses-covid-19-pandemic/'],[],0,0,0,[],[],https://twitter.com/AgingOphelia/status/1243224782956638209,False,,0,,"43.082366,-79.321248,40km",,,,,"[{'user_id': '3292901241', 'username': 'AgingOphelia'}]",,,,
